"alg","cl","FL","N","Fn","Cn","Mu","OR","CIl","CIu","Fe","Fc","pval","padj","palt","paltadj","overlapGenes"
"infomap",1,"synaptic vesicle endocytosis (GO:0048488)",887,30,18,5,2.56376522470032,1.45830452839517,3.66922592100547,8.21296296296296,13.6882716049383,0.000197701891862235,0.0448783294527273,0.999987526733347,0.999987526733347,"273, 1759, 1785, 26052, 6456"
"infomap",1,"presynaptic dense core vesicle exocytosis (GO:0099525)",887,9,18,3,3.35921730942127,1.88227515919928,4.83615945964326,16.4259259259259,8.21296296296296,0.000547573689839764,0.0621496137968132,0.999985880848827,0.999987526733347,"1759, 1785, 26052"
"infomap",1,"regulation of synaptic vesicle endocytosis (GO:1900242)",887,15,18,3,2.65909335637568,1.29481481183197,4.02337190091939,9.85555555555556,8.21296296296296,0.00274658690074078,0.207825075489386,0.999858352929034,0.999987526733347,"51429, 5532, 5533"
"infomap",1,"synaptic vesicle membrane (GO:0030672)",887,7,18,2,3.07269331469012,1.35989843604986,4.78548819333038,14.0793650793651,5.47530864197531,0.00769642018978199,0.436771845770128,0.999765923465262,0.999987526733347,"6456, 57030"
"infomap",2,"synaptic vesicle endocytosis (GO:0048488)",887,30,15,9,4.10735479895812,2.9872839694965,5.22742562841973,17.74,35.48,6.98665764445537e-11,1.58597128529137e-08,0.999999999998971,0.999999999998971,"2060, 58513, 6453, 163, 29924, 1213, 8301, 1175, 85439"
"infomap",2,"extrinsic component of presynaptic endocytic zone membrane (GO:0098894)",887,10,15,6,4.9744322454323,3.54897199780603,6.39989249305856,35.48,23.6533333333333,1.52572712496696e-09,1.7317002868375e-07,0.999999999990993,0.999999999998971,"2060, 58513, 163, 29924, 8301, 1175"
"infomap",2,"postsynaptic neurotransmitter receptor endocytosis (GO:0098884)",887,7,15,4,4.6571299249188,3.04635669120977,6.26790315862783,33.7904761904762,15.7688888888889,1.8096829769764e-06,0.000136932678591214,0.999999986322908,0.999999999998971,"2060, 163, 4646, 1175"
"infomap",2,"presynaptic endocytic zone membrane (GO:0098835)",887,6,15,3,4.28243647547739,2.58372498924327,5.98114796171152,29.5666666666667,11.8266666666667,7.61301169892089e-05,0.0043203841391376,0.9999992166061,0.999999999998971,"23396, 1213, 1211"
"infomap",2,"presynaptic endocytic zone (GO:0098833)",887,5,15,2,3.79692865969569,1.92576278273428,5.6680945366571,23.6533333333333,7.88444444444445,0.00259444943871139,0.117788004517497,0.999961543244556,0.999999999998971,"6453, 4646"
"infomap",2,"postsynaptic actin cytoskeleton (GO:0098871)",887,15,15,2,2.31901738762113,0.732736340150243,3.90529843509201,7.88444444444445,7.88444444444445,0.0246961204775448,0.934336558067111,0.998420637443281,0.999999999998971,"6453, 4646"
"infomap",3,"synapse (GO:0045202)",887,200,23,12,1.36676249020264,0.532804110090319,2.20072087031497,2.31391304347826,20.1209829867675,0.00159252409327737,0.261071449491614,0.999641957633142,0.999641957633142,"26986, 3184, 3178, 4670, 11100, 10949, 9444, 3185, 92906, 3191, 1993, 9987"
"infomap",3,"postsynaptic density (GO:0014069)",887,100,23,8,1.49858731355336,0.613692204396968,2.38348242270976,3.08521739130435,13.413988657845,0.00230018898230497,0.261071449491614,0.999560715074054,0.999641957633142,"5094, 3184, 5093, 3181, 4670, 3188, 3187, 220988"
"infomap",5,"synapse organization (GO:0050808)",887,6,52,3,2.83201214271058,1.20594819121329,4.45807609420787,8.52884615384616,0.984097633136095,0.00335787502237682,0.53393979061799,0.999854963372099,1,"2316, 23607, 26960"
"infomap",5,"modulation of chemical synaptic transmission (GO:0050804)",887,69,52,10,1.14153055098818,0.402822864188206,1.88023823778815,2.47212931995541,3.28032544378698,0.00470431533584132,0.53393979061799,0.998693702624051,1,"58512, 2534, 6774, 3717, 85358, 5335, 1009, 9229, 6792, 613"
"infomap",5,"postsynaptic density, intracellular component (GO:0099092)",887,37,52,6,1.21873013743278,0.295431485726397,2.14202878913916,2.76611226611227,1.96819526627219,0.0172558436834182,0.804014409512797,0.995847166287197,1,"2534, 85358, 9229, 2185, 6792, 613"
"infomap",5,"regulation of protein catabolic process at postsynapse, modulating synaptic transmission (GO:0099576)",887,4,52,2,2.8130106367387,0.832343131904561,4.79367814157283,8.52884615384616,0.656065088757397,0.0187537966087029,0.804014409512797,0.999269092841341,1,"4734, 9101"
"infomap",5,"structural constituent of postsynaptic density (GO:0098919)",887,11,52,3,1.84515514390134,0.487297066989965,3.20301322081271,4.6520979020979,0.984097633136095,0.022454154858365,0.804014409512797,0.99744288979278,1,"22941, 85358, 9229"
"infomap",5,"extrinsic component of postsynaptic membrane (GO:0098890)",887,6,52,2,2.11745960886736,0.396223174202074,3.83869604353264,5.68589743589744,0.656065088757397,0.0434540981854298,0.804014409512797,0.996642124977623,1,"1399, 26960"
"infomap",5,"postsynaptic density (GO:0014069)",887,100,52,10,0.678490022759972,-0.0450205999528016,1.40200064547275,1.70576923076923,3.28032544378698,0.0571264499113594,0.804014409512797,0.975581840191741,1,"10006, 22941, 160622, 6774, 85358, 25, 9456, 5604, 9101, 9762"
"infomap",5,"synaptic vesicle clustering (GO:0097091)",887,7,52,2,1.89311196348834,0.228605900497,3.55761802647968,4.87362637362637,0.656065088757397,0.0585823440190266,0.804014409512797,0.994366516398562,1,"10006, 1793"
"infomap",5,"postsynaptic specialization assembly (GO:0098698)",887,7,52,2,1.89311196348834,0.228605900497,3.55761802647968,4.87362637362637,0.656065088757397,0.0585823440190266,0.804014409512797,0.994366516398562,1,"1398, 1399"
"infomap",5,"postsynaptic specialization, intracellular component (GO:0099091)",887,7,52,2,1.89311196348834,0.228605900497,3.55761802647968,4.87362637362637,0.656065088757397,0.0585823440190266,0.804014409512797,0.994366516398562,1,"4067, 6714"
"infomap",5,"modification of synaptic structure (GO:0099563)",887,1,52,1,Inf,NA,Inf,17.0576923076923,0.328032544378698,0.0586245772266065,0.804014409512797,1,1,"58512"
"infomap",5,"postsynaptic membrane assembly (GO:0097104)",887,1,52,1,Inf,NA,Inf,17.0576923076923,0.328032544378698,0.0586245772266065,0.804014409512797,1,1,"2048"
"infomap",5,"G-protein coupled neurotransmitter receptor activity involved in regulation of postsynaptic cytosolic calcium levels (GO:0098872)",887,1,52,1,Inf,NA,Inf,17.0576923076923,0.328032544378698,0.0586245772266065,0.804014409512797,1,1,"2911"
"infomap",5,"synapse disassembly (GO:0098883)",887,1,52,1,Inf,NA,Inf,17.0576923076923,0.328032544378698,0.0586245772266065,0.804014409512797,1,1,"2043"
"infomap",5,"regulation of postsynapse to nucleus signaling pathway (GO:1905539)",887,1,52,1,Inf,NA,Inf,17.0576923076923,0.328032544378698,0.0586245772266065,0.804014409512797,1,1,"3717"
"infomap",5,"G protein-coupled neurotransmitter receptor activity involved in regulation of postsynaptic membrane potential (GO:0099579)",887,1,52,1,Inf,NA,Inf,17.0576923076923,0.328032544378698,0.0586245772266065,0.804014409512797,1,1,"2550"
"infomap",5,"integral component of postsynaptic membrane (GO:0099055)",887,49,52,6,0.876479348859823,-0.0279374522220414,1.78089614994169,2.08869701726845,1.96819526627219,0.0602125328710024,0.804014409512797,0.980032492171327,1,"2048, 6531, 2911, 2043, 2550, 9568"
"infomap",5,"postsynapse to nucleus signaling pathway (GO:0099527)",887,8,52,2,1.70958486103904,0.0839979874593824,3.3351717346187,4.26442307692308,0.656065088757397,0.0752291448321322,0.94872310427189,0.99135805842029,1,"10006, 6774"
"infomap",7,"anchored component of synaptic vesicle membrane (GO:0098993)",887,12,3,2,5.16364246322143,2.68353048523718,7.64375444120569,49.2777777777778,197.111111111111,0.000500096641929122,0.113521937717911,0.999998102100031,0.999998102100031,"5864, 5874"
"infomap",8,"integral component of postsynaptic density membrane (GO:0099061)",887,48,53,15,2.2598174269777,1.56814587941004,2.95148897454537,5.22995283018868,4.73656105375578,1.50388729485348e-08,3.4138241593174e-06,0.999999998547583,1,"2903, 2904, 2906, 2066, 57554, 2902, 1128, 2895, 81832, 4897, 2894, 57497, 491, 80059, 26045"
"infomap",8,"structural constituent of postsynaptic density (GO:0098919)",887,11,53,6,3.05239411021919,1.8297098280894,4.27507839234898,9.12864493996569,1.89462442150231,1.26207208917379e-05,0.00132758445769797,0.999999496093354,1,"9863, 1742, 1740, 1741, 1739, 1501"
"infomap",8,"integral component of presynaptic membrane (GO:0099056)",887,60,53,13,1.69415055005495,1.0026556592608,2.38564544084909,3.62610062893082,4.10501957992168,1.75451690444666e-05,0.00132758445769797,0.999997073198865,1,"3739, 3736, 2903, 2904, 2906, 2066, 6536, 2902, 9378, 1128, 3738, 6326, 57101"
"infomap",8,"regulation of postsynaptic density assembly (GO:0099151)",887,10,53,5,2.8490191442274,1.57571346599411,4.1223248224607,8.36792452830189,1.57885368458526,0.000126766618728684,0.00719400561285283,0.999993988450515,1,"26037, 9378, 869, 2895, 26045"
"infomap",8,"integral component of postsynaptic membrane (GO:0099055)",887,49,53,10,1.55616544582517,0.796669362725231,2.31566152892511,3.41547939930689,3.15770736917052,0.000335652244329614,0.0137401005258259,0.999937493763341,1,"3739, 3736, 3759, 6536, 1128, 4897, 3738, 2894, 491, 3751"
"infomap",8,"neurotransmitter receptor localization to postsynaptic specialization membrane (GO:0099645)",887,12,53,5,2.51013144749459,1.32615570575261,3.69410718923656,6.97327044025157,1.57885368458526,0.00036317446323769,0.0137401005258259,0.99997591256791,1,"1742, 1740, 1739, 2066, 81832"
"infomap",8,"postsynaptic density, intracellular component (GO:0099092)",887,37,53,8,1.59632549934161,0.757987841640859,2.43466315704235,3.6185619581846,2.52616589533642,0.00095610279439516,0.0310050477611002,0.999833152199435,1,"1741, 9228, 1739, 88, 85461, 60412, 8831, 392862"
"infomap",8,"regulation of presynapse assembly (GO:1905606)",887,16,53,5,2.05329782940491,0.956822796538799,3.14977286227102,5.22995283018868,1.57885368458526,0.001664840118495,0.0472398383622956,0.999826872387908,1,"9378, 869, 57555, 2895, 266727"
"infomap",8,"integral component of postsynaptic specialization membrane (GO:0099060)",887,17,53,5,1.96507064679439,0.881945471209682,3.0481958223791,4.92230854605993,1.57885368458526,0.00225213412575167,0.0568038273939588,0.999744665498921,1,"22871, 57502, 57555, 3751, 26045"
"infomap",8,"transmitter-gated ion channel activity involved in regulation of postsynaptic membrane potential (GO:1904315)",887,18,53,5,1.8838106535171,0.812110976656646,2.95551033037756,4.64884696016771,1.57885368458526,0.00297776157556642,0.0675951877653577,0.999634497243767,1,"2903, 2904, 2905, 2906, 2902"
"infomap",8,"voltage-gated ion channel activity involved in regulation of postsynaptic membrane potential (GO:1905030)",887,3,53,2,3.48635519000246,1.06926246217799,5.90344791782694,11.1572327044025,0.631541473834105,0.010116479728552,0.2087673543983,0.999797908160534,1,"3736, 3751"
"infomap",8,"ligand-gated ion channel activity involved in regulation of presynaptic membrane potential (GO:0099507)",887,16,53,4,1.72130780827744,0.55357204507925,2.88904357147564,4.18396226415094,1.26308294766821,0.012104290737282,0.228859492980761,0.998335159881505,1,"2903, 2904, 2906, 2902"
"infomap",8,"voltage-gated ion channel activity involved in regulation of presynaptic membrane potential (GO:0099508)",887,9,53,3,2.11384296839717,0.698826497282231,3.52885943951211,5.57861635220126,0.947312210751157,0.0131064907874445,0.228859492980761,0.998851744071037,1,"3739, 3736, 6326"
"infomap",8,"regulation of synaptic membrane adhesion (GO:0099179)",887,4,53,2,2.79200680809688,0.811718243799147,4.77229537239462,8.36792452830189,0.631541473834105,0.0194588837009601,0.294477773341197,0.999225924243856,1,"9863, 266727"
"infomap",8,"synapse assembly (GO:0007416)",887,4,53,2,2.79200680809688,0.811718243799147,4.77229537239462,8.36792452830189,0.631541473834105,0.0194588837009601,0.294477773341197,0.999225924243856,1,"2066, 9378"
"infomap",8,"integral component of presynaptic active zone membrane (GO:0099059)",887,29,53,5,1.25721731884475,0.250657476585291,2.26377716110421,2.88549121665582,1.57885368458526,0.0249025067926468,0.353304315120676,0.994404962554852,1,"2904, 2906, 2902, 9378, 491"
"infomap",8,"regulation of postsynaptic membrane neurotransmitter receptor levels (GO:0099072)",887,21,53,4,1.36689981381305,0.240188426024861,2.49361120160124,3.18778077268643,1.26308294766821,0.0318419979824714,0.425184326001236,0.99384068770721,1,"10928, 1741, 1501, 392862"
"infomap",8,"anchored component of postsynaptic density membrane (GO:0099031)",887,6,53,2,2.09645288750637,0.375652514444169,3.81725326056858,5.57861635220126,0.631541473834105,0.0450189666343436,0.567739190333111,0.996450047261872,1,"1742, 1740"
"infomap",8,"regulation of presynapse organization (GO:0099174)",887,1,53,1,Inf,NA,Inf,16.7358490566038,0.315770736917052,0.0597519729425029,0.625759923825037,1,1,"22871"
"infomap",8,"anterograde axonal transport of neurotransmitter receptor complex (GO:0140231)",887,1,53,1,Inf,NA,Inf,16.7358490566038,0.315770736917052,0.0597519729425029,0.625759923825037,1,1,"81832"
"infomap",8,"ATPase-coupled calcium ion transmembrane transporter activity involved in regulation of postsynaptic cytosolic calcium levels (GO:1905059)",887,1,53,1,Inf,NA,Inf,16.7358490566038,0.315770736917052,0.0597519729425029,0.625759923825037,1,1,"491"
"infomap",8,"postsynaptic specialization assembly (GO:0098698)",887,7,53,2,1.87210379053681,0.208048651100655,3.53615892997297,4.78167115902965,0.631541473834105,0.0606463362297393,0.625759923825037,0.994049457354146,1,"22871, 57555"
"infomap",8,"regulation of postsynaptic neurotransmitter receptor activity (GO:0098962)",887,9,53,2,1.533216093804,-0.0635214281125505,3.12995361572055,3.71907756813417,0.631541473834105,0.0963116879540186,0.950554485459227,0.986893509212555,1,"9228, 81832"
"infomap",8,"structural constituent of postsynaptic specialization (GO:0098879)",887,2,53,1,2.77378992358542,-0.0121908171561285,5.55977066432696,8.36792452830189,0.315770736917052,0.115997058082511,0.975234525360371,0.996493112197505,1,"9863"
"infomap",8,"regulation of trans-synaptic signaling by endocannabinoid, modulating synaptic transmission (GO:0150036)",887,2,53,1,2.77378992358542,-0.0121908171561285,5.55977066432696,8.36792452830189,0.315770736917052,0.115997058082511,0.975234525360371,0.996493112197505,1,"9378"
"infomap",8,"neurotransmitter uptake (GO:0001504)",887,2,53,1,2.77378992358542,-0.0121908171561285,5.55977066432696,8.36792452830189,0.315770736917052,0.115997058082511,0.975234525360371,0.996493112197505,1,"6536"
"infomap",8,"maintenance of postsynaptic density structure (GO:0099562)",887,2,53,1,2.77378992358542,-0.0121908171561285,5.55977066432696,8.36792452830189,0.315770736917052,0.115997058082511,0.975234525360371,0.996493112197505,1,"8525"
"infomap",12,"integral component of synaptic vesicle membrane (GO:0030285)",887,37,29,10,2.78493904267872,1.92863663162002,3.64124145373743,8.26654240447344,10.5469678953627,5.13283034072488e-08,1.16515248734455e-05,0.999999997150237,1,"6804, 10228, 6857, 8675, 6844, 23673, 6843, 127833, 9341, 8417"
"infomap",12,"synaptic vesicle to endosome fusion (GO:0016189)",887,3,29,3,Inf,NA,Inf,30.5862068965517,3.1640903686088,3.15223931276352e-05,0.00238519441332439,1,1,"10228, 23673, 8674"
"infomap",12,"regulation of synaptic vesicle priming (GO:0010807)",887,3,29,3,Inf,NA,Inf,30.5862068965517,3.1640903686088,3.15223931276352e-05,0.00238519441332439,1,1,"63908, 134957, 8775"
"infomap",12,"synaptic vesicle exocytosis (GO:0016079)",887,8,29,4,3.53105536892037,2.08919464032841,4.97291609751233,15.2931034482759,4.21878715814506,5.92162048032867e-05,0.00336051962258652,0.99999862780937,1,"6616, 6804, 6844, 112755"
"infomap",12,"exocytic insertion of neurotransmitter receptor to postsynaptic membrane (GO:0098967)",887,4,29,3,4.59395366924441,2.2973540538878,6.89055328460102,22.9396551724138,3.1640903686088,0.000123308184881632,0.0055981915936261,0.99999907287079,1,"6810, 8773, 116841"
"infomap",12,"synaptic vesicle (GO:0008021)",887,16,29,4,2.42303124606991,1.22355709808735,3.62250539405247,7.64655172413793,4.21878715814506,0.00128188070266411,0.0484978199174587,0.999910943389621,1,"26276, 134957, 9342, 9554"
"infomap",12,"presynaptic active zone membrane (GO:0048787)",887,4,29,2,3.45643351013741,1.45934329386055,5.45352372641428,15.2931034482759,2.10939357907253,0.00595000622437608,0.192950201847624,0.999876691815118,1,"63908, 8775"
"infomap",12,"extrinsic component of presynaptic membrane (GO:0098888)",887,5,29,2,3.04979949482427,1.22001592449962,4.87958306514891,12.2344827586207,2.10939357907253,0.00971569404756012,0.245051394310683,0.9996985255104,1,"6616, 134957"
"infomap",12,"regulation of synaptic vesicle fusion to presynaptic active zone membrane (GO:0031630)",887,5,29,2,3.04979949482427,1.22001592449962,4.87958306514891,12.2344827586207,2.10939357907253,0.00971569404756012,0.245051394310683,0.9996985255104,1,"6843, 10815"
"infomap",12,"calcium-dependent activation of synaptic vesicle fusion (GO:0099502)",887,6,29,2,2.7609471472243,1.02083800060814,4.50105629384046,10.1954022988506,2.10939357907253,0.0142787086292244,0.324126685883395,0.999410335115769,1,"6857, 127833"
"infomap",12,"regulation of synaptic vesicle exocytosis (GO:2000300)",887,18,29,3,1.86943250754627,0.569836068539307,3.16902894655324,5.09770114942529,3.1640903686088,0.0184365471874565,0.38046329195933,0.997941191445322,1,"134957, 9342, 9515"
"infomap",12,"synaptic vesicle fusion to presynaptic active zone membrane (GO:0031629)",887,1,29,1,Inf,NA,Inf,30.5862068965517,1.05469678953627,0.0326944757609922,0.494776399849681,1,1,"112755"
"infomap",12,"postsynaptic endosome membrane (GO:0098895)",887,1,29,1,Inf,NA,Inf,30.5862068965517,1.05469678953627,0.0326944757609922,0.494776399849681,1,1,"23673"
"infomap",12,"integral component of presynaptic endosome membrane (GO:0099067)",887,1,29,1,Inf,NA,Inf,30.5862068965517,1.05469678953627,0.0326944757609922,0.494776399849681,1,1,"8674"
"infomap",12,"regulation of exocytic insertion of neurotransmitter receptor to postsynaptic membrane (GO:0099145)",887,1,29,1,Inf,NA,Inf,30.5862068965517,1.05469678953627,0.0326944757609922,0.494776399849681,1,1,"10815"
"infomap",12,"synaptic vesicle priming (GO:0016082)",887,11,29,2,1.94414492353074,0.364761886172837,3.52352796088865,5.56112852664577,2.10939357907253,0.0472964426811448,0.671018280538742,0.995647108903672,1,"6843, 8775"
"infomap",12,"presynapse (GO:0098793)",887,90,29,6,0.877020328045319,-0.04925684129983,1.80329749739047,2.03908045977011,6.3281807372176,0.064253884638302,0.811597104343343,0.978778153504045,1,"6814, 6843, 63908, 10815, 134957, 8775"
"infomap",12,"extrinsic component of neuronal dense core vesicle membrane (GO:0098674)",887,2,29,1,3.42123340842258,0.623934244269953,6.2185325725752,15.2931034482759,1.05469678953627,0.0643557175250228,0.811597104343343,0.998966766003039,1,"134957"
"infomap",13,"modulation of chemical synaptic transmission (GO:0050804)",887,69,10,5,2.54184802618814,1.27638755060933,3.80730850176695,6.42753623188406,44.35,0.000458551127028976,0.104091105835577,0.999970603731907,0.999970603731907,"5576, 5577, 5575, 9590, 9465"
"infomap",14,"synaptic vesicle cycle (GO:0099504)",887,4,17,2,4.05814151355814,2.0327693321756,6.08351369494068,26.0882352941176,6.13840830449827,0.00202999646164422,0.460809196793238,0.999976813767507,1,"6853, 6854"
"infomap",14,"synaptic cleft (GO:0043083)",887,7,17,2,3.13838857395551,1.42092887348623,4.85584827442479,14.9075630252101,6.13840830449827,0.0068672708947771,0.779435246557201,0.999804265629193,1,"9211, 3908"
"infomap",16,"regulation of presynapse assembly (GO:1905606)",887,16,8,2,3.02505988864851,1.3398572828067,4.71026249449032,13.859375,27.71875,0.00802453274502457,0.815705156753819,0.999744061255481,1,"351, 4916"
"infomap",16,"trans-synaptic signaling by BDNF, modulating synaptic transmission (GO:0099183)",887,1,8,1,Inf,NA,Inf,110.875,13.859375,0.00901916572717054,0.815705156753819,1,1,"4915"
"infomap",16,"postsynaptic signaling pathway (GO:0098926)",887,2,8,1,4.8317364445798,1.96182784000138,7.70164504915822,55.4375,13.859375,0.0179670739373088,0.815705156753819,0.999928742482968,1,"4763"
"infomap",16,"postsynaptic density assembly (GO:0097107)",887,2,8,1,4.8317364445798,1.96182784000138,7.70164504915822,55.4375,13.859375,0.0179670739373088,0.815705156753819,0.999928742482968,1,"4916"
"infomap",16,"postsynaptic process involved in chemical synaptic transmission (GO:0099565)",887,2,8,1,4.8317364445798,1.96182784000138,7.70164504915822,55.4375,13.859375,0.0179670739373088,0.815705156753819,0.999928742482968,1,"56899"
"infomap",17,"modification of postsynaptic actin cytoskeleton (GO:0098885)",887,9,16,4,4.05583470746023,2.62290436684804,5.48876504807241,24.6388888888889,13.859375,8.47499933839355e-06,0.00192382484981534,0.999999883331547,1,"1072, 5217, 5216, 2017"
"infomap",17,"structural constituent of postsynaptic actin cytoskeleton (GO:0098973)",887,4,16,2,4.12828579565013,2.09840384995384,6.15816774134642,27.71875,6.9296875,0.0017939011405676,0.145582146235327,0.999980889060736,1,"60, 71"
"infomap",17,"postsynaptic actin cytoskeleton (GO:0098871)",887,15,16,3,2.80452520340283,1.42588582491246,4.18316458189319,11.0875,10.39453125,0.00192399312205278,0.145582146235327,0.999914036559725,1,"60, 71, 2017"
"infomap",17,"presynaptic actin cytoskeleton (GO:0099143)",887,1,16,1,Inf,NA,Inf,55.4375,3.46484375,0.0180383314543405,0.81894024802706,1,1,"71"
"infomap",17,"structural constituent of presynaptic actin cytoskeleton (GO:0098699)",887,1,16,1,Inf,NA,Inf,55.4375,3.46484375,0.0180383314543405,0.81894024802706,1,1,"5358"
"infomap",18,"integral component of presynaptic membrane (GO:0099056)",887,60,27,10,2.25438299117617,1.4226912293812,3.08607475297114,5.47530864197531,12.1673525377229,3.24619935676357e-06,0.000736887253985331,0.999999695528204,0.999999695528204,"2891, 2892, 1947, 2917, 6530, 6532, 1948, 23705, 2913, 2897"
"infomap",18,"presynapse assembly (GO:0099054)",887,13,27,5,3.18654044422526,1.99169857100271,4.38138231744782,12.6353276353276,6.08367626886145,1.94093150880811e-05,0.0022029572624972,0.999999339134584,0.999999695528204,"1947, 8497, 1948, 23705, 6386"
"infomap",18,"ligand-gated ion channel activity involved in regulation of presynaptic membrane potential (GO:0099507)",887,16,27,5,2.86455937258876,1.72583227700242,4.0032864681751,10.2662037037037,6.08367626886145,6.18387549682672e-05,0.00467913245926555,0.999997101955077,0.999999695528204,"2891, 2892, 2893, 2898, 2897"
"infomap",18,"transmitter-gated ion channel activity involved in regulation of postsynaptic membrane potential (GO:1904315)",887,18,27,5,2.6951467962663,1.58025603421113,3.81003755832147,9.12551440329218,6.08367626886145,0.00011628943616424,0.00659942550232063,0.999993555066379,0.999999695528204,"2891, 2892, 2893, 2898, 2897"
"infomap",18,"integral component of presynaptic active zone membrane (GO:0099059)",887,29,27,5,2.06897024181254,1.01654444214976,3.12139604147533,5.66411238825032,6.08367626886145,0.00127752474231469,0.0579996233010868,0.999868861374159,0.999999695528204,"2891, 2892, 2917, 2893, 5818"
"infomap",18,"integral component of postsynaptic density membrane (GO:0099061)",887,48,27,6,1.71642974982401,0.75759556228948,2.67526393735854,4.10648148148148,7.30041152263374,0.00227363687010948,0.0746070894155455,0.999660983587518,0.999999695528204,"2891, 2892, 2045, 2893, 1948, 25945"
"infomap",18,"integral component of postsynaptic membrane (GO:0099055)",887,49,27,6,1.69167601067107,0.733948692658751,2.64940332868339,4.02267573696145,7.30041152263374,0.00253682719097971,0.0746070894155455,0.999612560429461,0.999999695528204,"2891, 2892, 6532, 23705, 2898, 2913"
"infomap",18,"neurotransmitter reuptake (GO:0098810)",887,3,27,2,4.230040277676,1.79682508436696,6.66325547098504,21.9012345679012,2.43347050754458,0.00262932473711174,0.0746070894155455,0.999974766557225,0.999999695528204,"6530, 6532"
"infomap",18,"neurotransmitter receptor transport, endosome to postsynaptic membrane (GO:0098887)",887,7,27,2,2.6159349121944,0.928547256848068,4.30332256754074,9.38624338624339,2.43347050754458,0.0170626493859902,0.430357934513309,0.999186544541504,0.999999695528204,"80852, 23426"
"infomap",19,"regulation of presynaptic cytosolic calcium levels (GO:0099509)",887,6,11,2,3.88041766601282,2.06040394380312,5.70043138822251,26.8787878787879,14.6611570247934,0.00204319206996503,0.463804599882062,0.999972107506426,1,"1268, 23413"
"infomap",19,"integral component of presynaptic membrane (GO:0099056)",887,60,11,4,2.12433686158773,0.866368309497183,3.38230541367827,5.37575757575758,29.3223140495868,0.0043695339599106,0.495942104449853,0.999594869505387,1,"1813, 1129, 6529, 1268"
"infomap",19,"regulation of ATP metabolic process in the presynapse",887,1,11,1,Inf,NA,Inf,80.6363636363636,7.33057851239669,0.0124013528748596,0.703776775648279,1,1,"1268"
"infomap",19,"retrograde trans-synaptic signaling by endocannabinoid (GO:0098921)",887,1,11,1,Inf,NA,Inf,80.6363636363636,7.33057851239669,0.0124013528748596,0.703776775648279,1,1,"1268"
"infomap",19,"integral component of postsynaptic membrane (GO:0099055)",887,49,11,3,1.91195505128982,0.552221691198024,3.27168841138162,4.93692022263451,21.9917355371901,0.0191133813443278,0.867747513032482,0.997958957433913,1,"1813, 1129, 6529"
"infomap",19,"presynaptic modulation of chemical synaptic transmission (GO:0099171)",887,20,11,2,2.36015494481552,0.758423364323943,3.9618865253071,8.06363636363636,14.6611570247934,0.0235299492610855,0.890216413711068,0.998555295797648,1,"1813, 1129"
"infomap",20,"regulation of synaptic vesicle neurotransmitter loading (GO:0099162)",887,1,5,1,Inf,NA,Inf,177.4,35.48,0.00563697857948153,0.639797068771154,1,1,"2597"
"infomap",20,"ATP metabolic process in the postsynapse",887,1,5,1,Inf,NA,Inf,177.4,35.48,0.00563697857948153,0.639797068771154,1,1,"2597"
